{
  "adapter_version": "0.1.0",
  "cold_or_warm": "cold",
  "configuration_hash": "0fcf3516b9363bace19754a9d885df84ef0c172dd77f372d00834d046c8e48a4",
  "ended_at_unix_seconds": 1790097804,
  "fixture_revision": "sha256:dcde04f2df2c2c1370241c95bd7cca6984229c33abe6db6db138ca31e557c840",
  "results": [
    {
      "case_id": "dfb-taint-swift-modeled-external-summary-negative",
      "diagnostics": [
        "analysis memory budget exceeded: time maxrss 1630 MiB, case budget 512"
      ],
      "duration_ms": 79383,
      "outcome": "inconclusive",
      "peak_memory_mb": null,
      "raw_output": "reports/raw/codeql-swift-calibration/dfb-taint-swift-modeled-external-summary-negative/execution.json",
      "sink_anchors": [
        "DFB-SINK: modeled-external-sink"
      ],
      "source_anchors": [
        "DFB-SOURCE: modeled-external-input"
      ],
      "witness_checkpoints": []
    },
    {
      "case_id": "dfb-taint-swift-modeled-external-summary-positive",
      "diagnostics": [
        "analysis memory budget exceeded: time maxrss 706 MiB, case budget 512"
      ],
      "duration_ms": 40889,
      "outcome": "inconclusive",
      "peak_memory_mb": null,
      "raw_output": "reports/raw/codeql-swift-calibration/dfb-taint-swift-modeled-external-summary-positive/execution.json",
      "sink_anchors": [
        "DFB-SINK: modeled-external-sink"
      ],
      "source_anchors": [
        "DFB-SOURCE: modeled-external-input"
      ],
      "witness_checkpoints": []
    },
    {
      "case_id": "dfb-taint-swift-one-hop-relay-negative",
      "diagnostics": [
        "analysis memory budget exceeded: time maxrss 680 MiB, case budget 512"
      ],
      "duration_ms": 41216,
      "outcome": "inconclusive",
      "peak_memory_mb": null,
      "raw_output": "reports/raw/codeql-swift-calibration/dfb-taint-swift-one-hop-relay-negative/execution.json",
      "sink_anchors": [
        "DFB-SINK: one-hop-sink"
      ],
      "source_anchors": [
        "DFB-SOURCE: one-hop-input"
      ],
      "witness_checkpoints": []
    },
    {
      "case_id": "dfb-taint-swift-one-hop-relay-positive",
      "diagnostics": [
        "analysis memory budget exceeded: time maxrss 742 MiB, case budget 512"
      ],
      "duration_ms": 42286,
      "outcome": "inconclusive",
      "peak_memory_mb": null,
      "raw_output": "reports/raw/codeql-swift-calibration/dfb-taint-swift-one-hop-relay-positive/execution.json",
      "sink_anchors": [
        "DFB-SINK: one-hop-sink"
      ],
      "source_anchors": [
        "DFB-SOURCE: one-hop-input"
      ],
      "witness_checkpoints": []
    }
  ],
  "schema_version": 1,
  "started_at_unix_seconds": 1790097600,
  "tool": "codeql",
  "tool_build_identity": "codeql-cli:b47b3e59262c95aff4eeb84ac72d09e25a9c37e9",
  "tool_version": "2.27.0"
}
