{
  "adapter_version": "0.1.0",
  "cold_or_warm": "cold",
  "configuration_hash": "db05d851c13761b5e5480bc74577a06466a766335560da30699efc63103f5e68",
  "ended_at_unix_seconds": 1789764738,
  "fixture_revision": "sha256:4b62280924ed2e141dc8bb8e7b1bddfbd512d0201a3fa82f7b92b223eefca8c9",
  "results": [
    {
      "case_id": "dfb-taint-java-native-entrypoint-negative",
      "diagnostics": [],
      "duration_ms": 17967,
      "outcome": "not-reached",
      "peak_memory_mb": null,
      "raw_output": "reports/raw/codeql-java-native/dfb-taint-java-native-entrypoint-negative.sarif.json",
      "sink_anchors": [
        "DFB-SINK: native-entrypoint-exec"
      ],
      "source_anchors": [
        "DFB-SOURCE: native-entrypoint-argv"
      ],
      "witness_checkpoints": []
    },
    {
      "case_id": "dfb-taint-java-native-entrypoint-positive",
      "diagnostics": [
        "This command line depends on a [user-provided value](1)."
      ],
      "duration_ms": 14831,
      "outcome": "reached",
      "peak_memory_mb": null,
      "raw_output": "reports/raw/codeql-java-native/dfb-taint-java-native-entrypoint-positive.sarif.json",
      "sink_anchors": [
        "DFB-SINK: native-entrypoint-exec"
      ],
      "source_anchors": [
        "DFB-SOURCE: native-entrypoint-argv"
      ],
      "witness_checkpoints": []
    },
    {
      "case_id": "dfb-taint-java-native-persistence-negative",
      "diagnostics": [
        "This command line depends on a [user-provided value](1)."
      ],
      "duration_ms": 14567,
      "outcome": "reached",
      "peak_memory_mb": null,
      "raw_output": "reports/raw/codeql-java-native/dfb-taint-java-native-persistence-negative.sarif.json",
      "sink_anchors": [
        "DFB-SINK: native-persistence-exec"
      ],
      "source_anchors": [
        "DFB-SOURCE: native-persistence-env"
      ],
      "witness_checkpoints": []
    },
    {
      "case_id": "dfb-taint-java-native-persistence-positive",
      "diagnostics": [
        "This command line depends on a [user-provided value](1)."
      ],
      "duration_ms": 14703,
      "outcome": "reached",
      "peak_memory_mb": null,
      "raw_output": "reports/raw/codeql-java-native/dfb-taint-java-native-persistence-positive.sarif.json",
      "sink_anchors": [
        "DFB-SINK: native-persistence-exec"
      ],
      "source_anchors": [
        "DFB-SOURCE: native-persistence-env"
      ],
      "witness_checkpoints": []
    },
    {
      "case_id": "dfb-taint-java-native-propagator-negative",
      "diagnostics": [],
      "duration_ms": 14543,
      "outcome": "not-reached",
      "peak_memory_mb": null,
      "raw_output": "reports/raw/codeql-java-native/dfb-taint-java-native-propagator-negative.sarif.json",
      "sink_anchors": [
        "DFB-SINK: native-propagator-exec"
      ],
      "source_anchors": [
        "DFB-SOURCE: native-propagator-env"
      ],
      "witness_checkpoints": []
    },
    {
      "case_id": "dfb-taint-java-native-propagator-positive",
      "diagnostics": [
        "This command line depends on a [user-provided value](1)."
      ],
      "duration_ms": 14680,
      "outcome": "reached",
      "peak_memory_mb": null,
      "raw_output": "reports/raw/codeql-java-native/dfb-taint-java-native-propagator-positive.sarif.json",
      "sink_anchors": [
        "DFB-SINK: native-propagator-exec"
      ],
      "source_anchors": [
        "DFB-SOURCE: native-propagator-env"
      ],
      "witness_checkpoints": []
    },
    {
      "case_id": "dfb-taint-java-native-sanitizer-negative",
      "diagnostics": [],
      "duration_ms": 14542,
      "outcome": "not-reached",
      "peak_memory_mb": null,
      "raw_output": "reports/raw/codeql-java-native/dfb-taint-java-native-sanitizer-negative.sarif.json",
      "sink_anchors": [
        "DFB-SINK: native-sanitizer-exec"
      ],
      "source_anchors": [
        "DFB-SOURCE: native-sanitizer-env"
      ],
      "witness_checkpoints": []
    },
    {
      "case_id": "dfb-taint-java-native-sanitizer-positive",
      "diagnostics": [
        "This command line depends on a [user-provided value](1)."
      ],
      "duration_ms": 14522,
      "outcome": "reached",
      "peak_memory_mb": null,
      "raw_output": "reports/raw/codeql-java-native/dfb-taint-java-native-sanitizer-positive.sarif.json",
      "sink_anchors": [
        "DFB-SINK: native-sanitizer-exec"
      ],
      "source_anchors": [
        "DFB-SOURCE: native-sanitizer-env"
      ],
      "witness_checkpoints": []
    },
    {
      "case_id": "dfb-taint-java-native-source-sink-negative",
      "diagnostics": [],
      "duration_ms": 14414,
      "outcome": "not-reached",
      "peak_memory_mb": null,
      "raw_output": "reports/raw/codeql-java-native/dfb-taint-java-native-source-sink-negative.sarif.json",
      "sink_anchors": [
        "DFB-SINK: native-source-sink-exec"
      ],
      "source_anchors": [
        "DFB-SOURCE: native-source-sink-env"
      ],
      "witness_checkpoints": []
    },
    {
      "case_id": "dfb-taint-java-native-source-sink-positive",
      "diagnostics": [
        "This command line depends on a [user-provided value](1)."
      ],
      "duration_ms": 14656,
      "outcome": "reached",
      "peak_memory_mb": null,
      "raw_output": "reports/raw/codeql-java-native/dfb-taint-java-native-source-sink-positive.sarif.json",
      "sink_anchors": [
        "DFB-SINK: native-source-sink-exec"
      ],
      "source_anchors": [
        "DFB-SOURCE: native-source-sink-env"
      ],
      "witness_checkpoints": []
    },
    {
      "case_id": "dfb-taint-java-native-summary-negative",
      "diagnostics": [],
      "duration_ms": 15627,
      "outcome": "not-reached",
      "peak_memory_mb": null,
      "raw_output": "reports/raw/codeql-java-native/dfb-taint-java-native-summary-negative.sarif.json",
      "sink_anchors": [
        "DFB-SINK: native-summary-exec"
      ],
      "source_anchors": [
        "DFB-SOURCE: native-summary-env"
      ],
      "witness_checkpoints": []
    },
    {
      "case_id": "dfb-taint-java-native-summary-positive",
      "diagnostics": [
        "This command line depends on a [user-provided value](1)."
      ],
      "duration_ms": 15389,
      "outcome": "reached",
      "peak_memory_mb": null,
      "raw_output": "reports/raw/codeql-java-native/dfb-taint-java-native-summary-positive.sarif.json",
      "sink_anchors": [
        "DFB-SINK: native-summary-exec"
      ],
      "source_anchors": [
        "DFB-SOURCE: native-summary-env"
      ],
      "witness_checkpoints": []
    }
  ],
  "schema_version": 1,
  "started_at_unix_seconds": 1789764558,
  "tool": "codeql",
  "tool_build_identity": "codeql-cli:b47b3e59262c95aff4eeb84ac72d09e25a9c37e9 — 2.27.0 shipped suite codeql/java-queries@1.11.10:codeql-suites/java-security-extended.qls",
  "tool_version": "2.27.0"
}
